{
  "protocol_version": 3,
  "job_id": "bbbbbbbb-bbbb-4bbb-8bbb-bbbbbbbbbbbb",
  "capability": {
    "id": "document.summarize",
    "version": "1.0"
  },
  "provider": {
    "app_id": "reference-provider",
    "instance_id": "aaaaaaaa-aaaa-4aaa-8aaa-aaaaaaaaaaaa"
  },
  "status": "completed",
  "created_at": "2026-09-20T06:00:00Z",
  "updated_at": "2026-09-20T06:00:05Z",
  "input_artifacts": [
    {
      "artifact_id": "cccccccc-cccc-4ccc-8ccc-cccccccccccc",
      "media_type": "application/pdf",
      "byte_size": 9,
      "sha256": "ffffffffffffffffffffffffffffffffffffffffffffffffffffffffffffffff"
    }
  ],
  "result": {
    "outputs": [
      {
        "artifact_id": "eeeeeeee-eeee-4eee-8eee-eeeeeeeeeeee",
        "media_type": "text/plain",
        "display_name": "scan.txt",
        "byte_size": 0,
        "sha256": "e3b0c44298fc1c149afbf4c8996fb92427ae41e4649b934ca495991b7852b855"
      }
    ]
  }
}
