{
  "protocol_version": 3,
  "job_id": "bbbbbbbb-bbbb-4bbb-8bbb-bbbbbbbbbbbb",
  "capability": {
    "id": "document.ocr",
    "version": "1.1"
  },
  "provider": {
    "app_id": "document-ocr",
    "instance_id": "aaaaaaaa-aaaa-4aaa-8aaa-aaaaaaaaaaaa"
  },
  "status": "processing",
  "created_at": "2026-09-20T06:00:00Z",
  "updated_at": "2026-09-20T06:00:05Z",
  "input_artifacts": [
    {
      "artifact_id": "cccccccc-cccc-4ccc-8ccc-cccccccccccc",
      "media_type": "application/pdf",
      "byte_size": 9,
      "sha256": "ffffffffffffffffffffffffffffffffffffffffffffffffffffffffffffffff"
    }
  ]
}
